{
  "$id": "urn:ratatoskr:contracts:events:v1:AiArchiveImport",
  "$schema": "https://json-schema.org/draft/2020-12/schema",
  "title": "AiArchiveImport",
  "description": "The head of one import: identity, owner, immutable evidence, timing, stamps, completeness.\n\nThis type is both the head member of [`AiArchiveSnapshot`] and the payload of\n`ai_archive.archive.imported.v1`, so the event and the snapshot cannot disagree about what\nan import claims.\n\n# Cross-field invariant\n\nRe-checkable through [`Self::validate`]:\n\n- **A1** every completeness state other than `complete` requires at least one gap naming\n  what is missing. The rule is asymmetric on purpose: a complete import carries zero gaps by\n  definition — non-blocking problems travel as warnings instead, exactly like the social\n  snapshot's complete-capture rule.\n\n`Deserialize` is hand-written below because invariant A1 is cross-field.",
  "type": "object",
  "properties": {
    "ai_archive_id": {
      "description": "Ratatoskr's own identity for this import, minted once per parse of one export. Bare\ncanonical UUID on the wire.",
      "$ref": "#/$defs/AiArchiveId"
    },
    "completeness_report": {
      "description": "The evidence-based completeness report.",
      "$ref": "#/$defs/AiCompletenessReport"
    },
    "imported_at": {
      "description": "Instant the producing service finished importing the export into normalized nodes.\nObserved: the producer's clock, not the provider's.",
      "$ref": "#/$defs/WireTimestamp"
    },
    "owner": {
      "description": "The user whose archive was imported.",
      "$ref": "#/$defs/TenantRef"
    },
    "parser_name": {
      "description": "Which parser produced the normalized nodes of this import.",
      "$ref": "#/$defs/ParserName"
    },
    "parser_version": {
      "description": "The build of [`AiArchiveImport::parser_name`].",
      "$ref": "#/$defs/ParserVersion"
    },
    "provider": {
      "description": "The provider whose account was exported. Open token.",
      "$ref": "#/$defs/AiProvider"
    },
    "source_export": {
      "description": "Reference to the immutable raw provider export backing every node of this import. The\npreservation channel of last resort: re-parsing these bytes must remain possible even\nwhere this contract cannot represent something the export sent.",
      "$ref": "#/$defs/BlobRef"
    },
    "warnings": {
      "description": "Non-blocking problems recorded during import that did not create a gap.",
      "type": "array",
      "items": {
        "$ref": "#/$defs/WarningEnvelope"
      }
    }
  },
  "additionalProperties": true,
  "required": [
    "ai_archive_id",
    "completeness_report",
    "imported_at",
    "owner",
    "parser_name",
    "parser_version",
    "provider",
    "source_export"
  ],
  "x-ratatoskr-provenance": {
    "canonical_source": "ratatoskr_ai_archive_contracts::AiArchiveImport",
    "contract_id": "ai_archive.archive_imported",
    "contract_major_version": 1,
    "generated": "DO NOT EDIT — generated by contractsc from the canonical Rust source. Change the Rust type and run `cargo contracts generate`.",
    "generator": "contractsc",
    "generator_version": "0.1.0",
    "schemars_version": "1.2.2",
    "source_digest": "sha256:5484f584c0067c822ecb6045750b0c9f4cce66b12ef3fed2aeb2473f1dc83142",
    "validation_note": "This schema is a LOWER BOUND on validity. Cross-field invariants and canonical-form rules are enforced by the canonical Rust type; see fixtures/invalid-expectations.toml for which layer rejects what."
  },
  "x-ratatoskr-unknown-policy": "preserve",
  "$defs": {
    "AiArchiveCompleteness": {
      "description": "Whether one import obtained the whole export, stated per `docs/ARCHITECTURE.md` S8.3.\n\n**Closed on purpose**: indexing depth, retention and re-import scheduling hang off this\nstate, so an unrecognized value must stop processing rather than be read as \"whole enough\".\nCompleteness is evidence-based: a parser may not mark an import `complete` merely because it\nparsed every file it knows about.",
      "oneOf": [
        {
          "description": "Every record parsed and every referenced asset was stored.",
          "type": "string",
          "const": "complete"
        },
        {
          "description": "Every conversation record parsed; some assets are missing or were refused.",
          "type": "string",
          "const": "conversations_complete"
        },
        {
          "description": "Some records did not parse or were not present; the gaps say which.",
          "type": "string",
          "const": "structurally_partial"
        },
        {
          "description": "Records parsed but asset storage was incomplete.",
          "type": "string",
          "const": "assets_partial"
        },
        {
          "description": "The parser could not determine what the export contained at all.",
          "type": "string",
          "const": "unknown"
        },
        {
          "description": "The export failed an integrity check before parsing could be trusted.",
          "type": "string",
          "const": "failed_validation"
        }
      ]
    },
    "AiArchiveId": {
      "title": "AiArchiveId",
      "description": "Identity of one import of a provider AI account export. Bare canonical lowercase hyphenated UUID; not namespaced.",
      "type": "string",
      "format": "uuid",
      "examples": [
        "018f0000-0000-7000-8000-000000000001"
      ],
      "pattern": "^[0-9a-f]{8}-[0-9a-f]{4}-[0-9a-f]{4}-[0-9a-f]{4}-[0-9a-f]{12}$"
    },
    "AiCompletenessReport": {
      "description": "The evidence-based completeness report of one import.\n\n`conversation_count` and `gap_count` are **verifiable**: they are checked against the\npayload wherever the payload carries the nodes they count (invariant A2/A3). The imported\nevent's head has no tree attached, so there those two counts are producer-asserted like the\nother two; on a snapshot they are enforced.",
      "type": "object",
      "properties": {
        "asset_count": {
          "description": "Asset references stored during the import (files, artifacts, images).",
          "type": "integer",
          "format": "uint32",
          "minimum": 0
        },
        "completeness": {
          "description": "Whether the import is whole. Closed vocabulary.",
          "$ref": "#/$defs/AiArchiveCompleteness"
        },
        "conversation_count": {
          "description": "Conversations in this import.",
          "type": "integer",
          "format": "uint32",
          "minimum": 0
        },
        "gap_count": {
          "description": "Gap entries carried in `gaps`. Verified against `gaps` length.",
          "type": "integer",
          "format": "uint32",
          "minimum": 0
        },
        "gaps": {
          "description": "Every hole the parser found, each naming what is missing.",
          "type": "array",
          "items": {
            "$ref": "#/$defs/AiGap"
          }
        },
        "message_count": {
          "description": "Messages across all conversations of this import.",
          "type": "integer",
          "format": "uint32",
          "minimum": 0
        }
      },
      "additionalProperties": false,
      "required": [
        "asset_count",
        "completeness",
        "conversation_count",
        "gap_count",
        "message_count"
      ]
    },
    "AiGap": {
      "description": "One named hole in an import: what is missing, and where it was noticed.",
      "type": "object",
      "properties": {
        "affected_count": {
          "description": "How many records this single gap entry stands for, when the parser batches identical\nholes. Absent means one.",
          "type": [
            "integer",
            "null"
          ],
          "format": "uint32",
          "minimum": 0
        },
        "detail": {
          "description": "User-safe explanation of the hole, stable for display and triage.",
          "$ref": "#/$defs/SafeMessage"
        },
        "external_ref": {
          "description": "The provider id of the affected record, when one record is identifiable.",
          "anyOf": [
            {
              "$ref": "#/$defs/EntityLocalId"
            },
            {
              "type": "null"
            }
          ]
        },
        "gap_kind": {
          "description": "What kind of hole this is. Open token.",
          "$ref": "#/$defs/AiGapKind"
        }
      },
      "additionalProperties": true,
      "required": [
        "detail",
        "gap_kind"
      ],
      "x-ratatoskr-unknown-policy": "preserve"
    },
    "AiGapKind": {
      "title": "AiGapKind",
      "description": "What kind of hole a [`AiGap`] records, e.g. `missing_file`, `truncated_conversation`,\n`undecodable_record`.\n\n**Open on purpose**: providers find new ways to be incomplete, and a consumer must be\nable to carry a gap it does not classify rather than drop it. Branch on equality with\nknown kinds; treat everything else generically.\n\n[`AiGap`]: crate::AiGap",
      "type": "string",
      "examples": [
        "missing_file",
        "truncated_conversation",
        "undecodable_record"
      ],
      "maxLength": 32,
      "pattern": "^[a-z][a-z0-9_]{0,31}$"
    },
    "AiProvider": {
      "title": "AiProvider",
      "description": "The AI provider an archive came from, e.g. `chatgpt`, `claude`.\n\n**Open on purpose.** A validated token, not an enum: a provider added by a later milestone\nmust not break a running consumer, and no consumer may assume the vocabulary is\nexhaustive. Branch on equality with known tokens; treat everything else generically. The\ngrammar is the event-type segment grammar (`EventType::SEGMENT_PATTERN`), so one\nsnake_case alphabet covers both.",
      "type": "string",
      "examples": [
        "chatgpt",
        "claude"
      ],
      "maxLength": 32,
      "pattern": "^[a-z][a-z0-9_]{0,31}$"
    },
    "BlobOwner": {
      "title": "BlobOwner",
      "description": "Deployment identity of the service that owns and resolves a blob.",
      "type": "string",
      "examples": [
        "ratatoskr-extractor",
        "ratatoskr-vault"
      ],
      "maxLength": 64,
      "pattern": "^[a-z][a-z0-9-]{1,63}$"
    },
    "BlobRef": {
      "description": "Reference to content-addressed bytes owned by one service.\n\nThis is a reference, not a storage API. The owner writes and resolves the bytes under its own\ncontent-addressed directory. No host, filesystem path, signed URL, credentials, or expiry can\nappear in this contract.",
      "type": "object",
      "properties": {
        "digest": {
          "description": "Digest that names the bytes and lets a reader verify them.",
          "$ref": "#/$defs/ContentDigest"
        },
        "length_bytes": {
          "description": "Exact byte length of the stored value.",
          "type": "integer",
          "format": "uint64",
          "minimum": 0
        },
        "media_type": {
          "description": "Media type of the stored bytes.",
          "$ref": "#/$defs/MediaType"
        },
        "owner_service": {
          "description": "Service that owns the bytes and their lifecycle.",
          "$ref": "#/$defs/BlobOwner"
        }
      },
      "additionalProperties": false,
      "required": [
        "digest",
        "length_bytes",
        "media_type",
        "owner_service"
      ]
    },
    "ContentDigest": {
      "description": "A content digest with an explicit algorithm.",
      "type": "object",
      "properties": {
        "algorithm": {
          "description": "Hash algorithm used to produce `hex`.",
          "$ref": "#/$defs/DigestAlgorithm"
        },
        "hex": {
          "description": "Lowercase hexadecimal digest bytes.",
          "$ref": "#/$defs/DigestHex"
        }
      },
      "additionalProperties": false,
      "required": [
        "algorithm",
        "hex"
      ]
    },
    "DigestAlgorithm": {
      "description": "Algorithm used to calculate a content digest.",
      "oneOf": [
        {
          "description": "SHA-256.",
          "type": "string",
          "const": "sha256"
        }
      ]
    },
    "DigestHex": {
      "title": "DigestHex",
      "description": "Lowercase hexadecimal bytes of a content digest.",
      "type": "string",
      "examples": [
        "0000000000000000000000000000000000000000000000000000000000000000"
      ],
      "maxLength": 64,
      "pattern": "^[0-9a-f]{64}$"
    },
    "EntityLocalId": {
      "title": "EntityLocalId",
      "description": "The identity half of a qualified reference. Opaque: a UUID, a provider's numeric string,\nor a provider slug. May contain `:`, because the kind separator is the FIRST colon only.",
      "type": "string",
      "examples": [
        "018f0000-0000-7000-8000-000000000002",
        "123"
      ],
      "maxLength": 256,
      "pattern": "^[A-Za-z0-9][A-Za-z0-9._~:@+-]{0,255}$"
    },
    "ErrorCode": {
      "title": "ErrorCode",
      "description": "Stable, machine-actionable error code: 2–4 dot-separated snake_case segments, e.g.\n`platform.operation.not_found`.\n\nThe code is the contract; the message is not. A consumer branches on this and on nothing\nelse (`AGENTS.md` principle 7: \"Separate stable error codes from human-readable messages\nand provider diagnostics\"). Service-owned: `ARCHITECTURE.md` S5.5 requires provider\nresponses to be normalized into service-owned codes, so a provider's own code never\nappears here.",
      "type": "string",
      "examples": [
        "platform.operation.not_found",
        "content.extraction.unsupported_media"
      ],
      "maxLength": 128,
      "pattern": "^[a-z][a-z0-9_]{0,31}(\\.[a-z][a-z0-9_]{0,31}){1,3}$"
    },
    "FieldPath": {
      "title": "FieldPath",
      "description": "RFC 6901 JSON Pointer to the offending member of the rejected payload, restricted to\nidentifier-shaped tokens, e.g. `/blocks/3/text`.\n\nStructure only. The restricted alphabet makes it structurally impossible to smuggle a\nrejected **value** (which may be user content or a credential) into an error payload —\n`/tenant_id=alice@example.com` does not parse. `ARCHITECTURE.md` S5.5: \"validation errors\nidentify safe field paths.\"",
      "type": "string",
      "examples": [
        "/blocks/3/text",
        "/tenant_id"
      ],
      "maxLength": 256,
      "pattern": "^(/[A-Za-z0-9_-]+)+$"
    },
    "MediaType": {
      "title": "MediaType",
      "description": "Internet media type of stored bytes, without parameters.",
      "type": "string",
      "examples": [
        "text/html",
        "application/pdf"
      ],
      "maxLength": 255,
      "pattern": "^[a-z0-9][a-z0-9!#$&^_.+-]{0,126}/[a-z0-9][a-z0-9!#$&^_.+-]{0,126}$"
    },
    "ParserName": {
      "title": "ParserName",
      "description": "Which parser normalized a node, e.g. `chatgpt_export`, `claude_export`.\n\n**Open on purpose**, like [`AiProvider`]: a parser rename or addition must not break a\nrunning consumer. Opaque to consumers beyond display and staleness comparison; no\nconsumer may branch on its internals.\n\n[`AiProvider`]: crate::AiProvider",
      "type": "string",
      "examples": [
        "chatgpt_export",
        "claude_export"
      ],
      "maxLength": 32,
      "pattern": "^[a-z][a-z0-9_]{0,31}$"
    },
    "ParserVersion": {
      "title": "ParserVersion",
      "description": "The build of the [`ParserName`] that normalized a node.\n\nBounded printable ASCII without whitespace: semver (`1.4.2`), date-based (`2026.08.1`)\nand commit-sha spellings all fit. Deliberately **not** semver-typed — parsers version in\nmore than one scheme, and any tighter grammar would reject an honest stamp. Consumers MAY\ncompare stamps for staleness; none may parse them for semantics.\n\n[`ParserName`]: crate::ParserName",
      "type": "string",
      "examples": [
        "1.4.2",
        "2026.08.1"
      ],
      "maxLength": 64,
      "pattern": "^[!-~]{1,64}$"
    },
    "SafeMessage": {
      "title": "SafeMessage",
      "description": "Human-readable text safe to show to an operator or an end user.\n\n1..=1024 characters with no C0 or DEL control characters. The newline ban is the point: it\nmakes it structurally impossible to smuggle a stack trace or a forged log line into a wire\nmessage (`ARCHITECTURE.md` S5.5 \"no stack traces or secrets in wire errors\", S14).\n\nNot machine-parsed and not stable across releases; changing a message is not a contract\nchange. Consumers branch on codes, never on this.",
      "type": "string",
      "examples": [
        "The requested document does not exist."
      ],
      "maxLength": 1024,
      "pattern": "^[^\\x00-\\x1f\\x7f]{1,1024}$"
    },
    "TenantRef": {
      "title": "TenantRef",
      "description": "The owner of the data a record concerns, wire form `user:<uuid>`. The kind set is closed: a consumer that cannot understand the owner kind must reject the record rather than process it.",
      "type": "string",
      "examples": [
        "user:018f0000-0000-7000-8000-000000000005"
      ],
      "maxLength": 41,
      "pattern": "^user:[0-9a-f]{8}-[0-9a-f]{4}-[0-9a-f]{4}-[0-9a-f]{4}-[0-9a-f]{12}$"
    },
    "WarningEnvelope": {
      "description": "A non-terminal problem that did not prevent the recorded outcome.\n\nA distinct type, not a flag on [`ErrorEnvelope`]: `ARCHITECTURE.md` S5.5 requires\n\"partial-success warnings are distinct from terminal errors\", and a shared type with a\nseverity field would let a producer emit a \"warning\" that consumers treat as fatal.",
      "type": "object",
      "properties": {
        "code": {
          "description": "Stable machine-actionable code, same grammar as an error code.",
          "$ref": "#/$defs/ErrorCode"
        },
        "field_path": {
          "description": "Where in the input the problem was observed, when a path applies.",
          "anyOf": [
            {
              "$ref": "#/$defs/FieldPath"
            },
            {
              "type": "null"
            }
          ]
        },
        "message": {
          "description": "User-safe explanation.",
          "$ref": "#/$defs/SafeMessage"
        }
      },
      "additionalProperties": true,
      "required": [
        "code",
        "message"
      ],
      "x-ratatoskr-unknown-policy": "preserve"
    },
    "WireTimestamp": {
      "title": "WireTimestamp",
      "description": "An instant on the wire: RFC 3339 in UTC with the literal `Z` designator. Exactly one spelling is accepted per instant — an input that does not re-render to itself is rejected. The field holding it declares the clock authority.",
      "type": "string",
      "format": "date-time",
      "examples": [
        "2026-08-17T10:00:00Z"
      ],
      "pattern": "^\\d{4}-\\d{2}-\\d{2}T\\d{2}:\\d{2}:\\d{2}(\\.\\d{1,9})?Z$"
    }
  }
}
